{
  "schema": "aml-verifier-manifest/1",
  "prototype": true,
  "verifier_id": "aru-aml-http-reference",
  "implementation": "ĀML reference HTTP verifier",
  "runtime": "Node.js HTTP service",
  "version": "1",
  "artifact_types": ["aml-witness-bundle/1", "aml-execution-receipt"],
  "report_schema": "aml-verification-report/1",
  "canonicalization_profiles": ["sorted-json-v1"],
  "signature_algorithms": ["ECDSA-P256-SHA256", "Ed25519"],
  "verification_url": "http://127.0.0.1:8787/v1/verify-witness-bundle",
  "source_url": "https://github.com/aruintelligence/aml-core/blob/main/server/httpServer.js",
  "claim_boundary": "Reference service capability declaration. Deployment, operator identity, authentication, and institutional independence are outside this manifest."
}
