{
  "schema": "aml-verifier-manifest/1",
  "prototype": true,
  "verifier_id": "aru-aml-browser-reference",
  "implementation": "ĀML browser detached verifier",
  "runtime": "WebCrypto-capable browser",
  "version": "1",
  "artifact_types": ["aml-witness-bundle/1", "aml-browser-evidence/1", "aml-dom-receipt/1"],
  "report_schema": "aml-verification-report/1",
  "canonicalization_profiles": ["sorted-json-v1"],
  "signature_algorithms": ["ECDSA-P256-SHA256"],
  "verification_url": "https://aruintelligence.github.io/aml-core/detached-verifier.html",
  "source_url": "https://github.com/aruintelligence/aml-core/blob/main/docs/aml-witness-bundle.js",
  "claim_boundary": "Reference implementation capability declaration. It does not prove independence, institutional identity, or correctness."
}
